{
  "plan_id": "secret_rewrap_123",
  "source_key_ref": "kms:palimpsest:prod:control-plane-key-1",
  "target_key_ref": "kms:palimpsest:prod:control-plane-key-2",
  "status": "planned",
  "matched_secret_count": 42,
  "rewrapped_secret_count": 0,
  "error_message": null,
  "created_at": "2026-05-18 12:00:00+00",
  "completed_at": null
}
